Title,Link,Description
"상주시, 탄소중립 녹색성장 기본계획 최종보고회",http://www.kbsm.net/news/view.php?idx=471591,상주시의 탄소중립 정책을 체계적으로 통합하고 실질적 이행 방안을 수립하기 위한 최종 단계이다.... 이날 보고회에서 제시된 의견을 반영한 최종 기본계획안을 수립해 5월까지 환경부에 제출할 계획이며 이후 매년... 
"상주시, 탄소중립 녹색성장 기본계획 최종보고회 개최",http://www.newsprime.co.kr/news/article.html?no=683860,"상주시의 탄소중립 정책을 체계적으로 통합하고 실질적 이행 방안을 수립하기 위한 최종 단계이다.... 이날 보고회에서 제시된 의견을 반영한 최종 기본계획안을 수립해 5월까지 환경부에 제출할 계획이며, 이후 매년... "
“한우 메탄 배출량 더 정확하게 산정”…배출계수 추가 개발,https://www.livesnews.com/news/article.html?no=49923,"평가, 탄소중립 정책 수립 등에 폭넓게 사용된다. 우리나라를 포함한 대부분의 국가에서는 ‘기후변화에... 우리나라에서는 국립축산과학원이 한우 장내 발효 메탄 배출계수 4종을 추가 개발하고, 환경부 산하... "
서산시의회 활발한 의정 추진,https://www.joongdo.co.kr/web/view.php?key=20250416010005719,"셋째, 탄소 중립과 자원순환 중심의 고강도 환경규제 도입이다. 플라스틱 사용 제한, 온실가스 감축 목표... 하나, 산업부·환경부·고용노동부 등 관계부처와 지방자치단체, 기업, 전문가, 지역사회를 아우르는 대산... "
"[손병관의 뉴스프레소] 윤석열, '계엄 실패' 뒤 탄핵·구속 운명 알고 있...",https://n.news.naver.com/mnews/article/047/0002469886?sid=102,"산업통상자원부는 산업부와 통상부로 분리하고, 에너지 관련 업무는 환경부 일부 기능과 합쳐... 수도권의 한 중진 의원은 경향신문에 &quot;기후위기를 해결하기 위해선 결국 탈석탄 기조로 가야 한다&quot;며 &quot;탄소중립을... "
"상주시, '탄소중립 녹색성장 기본계획' 최종 보고회 개최",https://www.startuptoday.co.kr/news/articleView.html?idxno=435565,시는 이날 보고회에서 수렴된 의견을 반영해 최종 계획안을 확정한 뒤 오는 5월까지 환경부에 제출할... 살린 실천 가능한 정책을 지속적으로 추진해 상주가 탄소중립 시대를 선도해 나가도록 최선을 다하겠다&quot;고 말했다.
지속 가능한 미래를 위해 노력하는 사람들 (3),https://www.allurekorea.com/2025/04/16/%ec%a7%80%ec%86%8d-%ea%b0%80%eb%8a%a5%ed%95%9c-%eb%af%b8%eb%9e%98%eb%a5%bc-%ec%9c%84%ed%95%b4-%eb%85%b8%eb%a0%a5%ed%95%98%eb%8a%94-%ec%82%ac%eb%9e%8c%eb%93%a4-3/?utm_source=naver&utm_medium=partnership,이런 변화 이전에는 탄소중립을 목표로 한 환경정책이 전 세계에서 쏟아졌다. 정책적 발전을 어떻게... 시중에 판매되는 다양한 친환경 제품과 환경부에서 부여하는 친환경 마크에 대한 모니터링이 필요한 시점이다.... 
한우 메탄 배출량 더 정확하게 산정…배출계수 추가 개발,http://www.newsam.co.kr/news/article.html?no=39876,"평가, 탄소중립 정책 수립 등에 폭넓게 사용된다. 우리나라를 포함한 대부분의 국가에서는 ‘기후변화에... 우리나라에서는 국립축산과학원이 한우 장내 발효 메탄 배출계수 4종을 추가 개발하고, 환경부 산하... "
"김영록 지사, 환경부에 &quot;상수원 주민지원·탄소중립 실증단지&quot; 적극 건...",http://www.koreareport.co.kr/news/articleView.html?idxno=35122,내 적벽 일대의 규제개선 및 주민 불편 해소 필요성도 전달했다. 김완섭 환경부 장관은 &quot;주민 불편 해소와 탄소중립 정책 방향에 충분히 공감한다&quot;며 &quot;건의 내용을 면밀히 검토해 지원 방안을 마련하겠다&quot;고 화답했다.
"서산시의회, 대산석유화학단지 '산업위기 선제 대응지역' 지정 강력 촉...",https://www.gukjenews.com/news/articleView.html?idxno=3251197,"특히 중국과 중동 국가들의 공격적인 생산 능력 확대와 가격 경쟁력 강화, 불안정한 유가 변동성, 탄소 중립... 마련 △산업통상자원부, 환경부, 고용노동부 등 관계 부처와 지방자치단체·기업·전문가·지역 사회를... "
"상주시, 탄소중립 녹색성장 기본계획 최종보고회",https://daily.hankooki.com/news/articleView.html?idxno=1204565,상주시의 탄소중립 정책을 체계적으로 통합하고 실질적 이행 방안을 수립하기 위한 최종 단계이다.... 시는 이날 보고회에서 제시된 의견을 반영한 최종 기본계획안을 수립해 5월까지 환경부에 제출할 계획이다.
"서산시의회, '대산석유화학단지, 산업위기 선제 대응지역 지정 촉구 건...",http://www.newstnt.com/news/articleView.html?idxno=479430,"/ 서산시의회 제공 아울러 안원기 의원은 &quot;셋째, 탄소중립과 자원순환 중심의 고강도 환경규제 도입이라&quot;면서... 산업부·환경부·고용노동부 등 관계부처와 지방자치단체·기업·전문가·지역사회를 아우르는 대산산업전환... "
"상주시, '탄소중립 녹색성장 기본계획' 최종보고회 개최",https://n.news.naver.com/mnews/article/277/0005578521?sid=102,"상주시의 탄소중립 정책을 체계적으로 정비하고 실질적 이행방안을 마련하기 위한 마지막 단계다. 시는... 시는 이번 보고회에서 수렴된 의견을 반영해 오는 5월까지 최종 기본계획안을 마련, 환경부에 제출할 계획이다.... "
한우 메탄 배출량 더 정확하게 산정…배출계수 추가 개발,http://sjbnews.com/news/news.php?number=847237,"평가, 탄소중립 정책 수립 등에 폭넓게 사용된다. 우리나라를 포함한 대부분의 국가에서는 ‘기후변화에... 우리나라에서는 국립축산과학원이 한우 장내 발효 메탄 배출계수 4종을 추가 개발하고, 환경부 산하... "
"[위클리오늘] 울산 중구, '2050탄소중립녹색성장위원회' 개최",http://www.weeklytoday.com/news/articleView.html?idxno=691075,'울산광역시 중구 2050 탄소중립녹색성장위원회'는 탄소중립 실현을 위한 주요 정책과 계획 등을 심의하고... 해당 계획은 추후 환경부의 승인을 거쳐 최종 확정된다. 중구 관계자는 &quot;탄소중립은 미래 세대를 위해... 
"봇물 터진 기후소송, 세계 각국의 사례는?",https://www.ekoreanews.co.kr/news/articleView.html?idxno=78964,"없이 환경부에 책임을 전가한 것이 국민의 생명권, 건강권, 주거권, 노동권, 재산권, 문화권 등을 침해한다... 헌재는 청구인들의 의견을 받아들여 &quot;「탄소중립 기본법」이 2031~2049년 감축 목표가 없어 미래에 과중한... "
"서산시의회, 대산유화단지 구조적 위기 해결을 위한 정부 지원 요구",https://n.news.naver.com/mnews/article/656/0000128742?sid=102,"셋째, 탄소중립과 자원순환 중심의 고강도 환경규제 도입이다. 플라스틱 사용 제한, 온실가스 감축 목표 상향... 넷째, 산업부·환경부·고용노동부 등 관계부처와 지방자치단체, 기업, 전문가, 지역사회를 아우르는... "
"농진청, 배출계수 추가 개발⋯한우 메탄 배출량 더 정확하게 산정",https://www.viva100.com/article/20250415501325,"평가, 탄소중립 정책 수립 등에 폭넓게 사용된다. 우리나라를 포함한 대부분의 국가에서는 ‘기후변화에... 우리나라에서는 국립축산과학원이 한우 장내 발효 메탄 배출계수 4종을 추가 개발하고 환경부 산하... "
"“트럼프와 반대로 간다”…중국, 탄소중립 정책 강화",https://www.ekn.kr/web/view.php?key=20250415026047263,"제시하면서 탄소중립 정책을 강화할 방침이다. 중국 생태환경부는 철강, 시멘트, 알루미늄 등 3개 업중을 배출권 거래시장에 정식으로 편입한다고 밝혔다. 탄소배출량을 측정해 탄소발자국 관리 대상을 의류·전자 등과... "
&quot;한우 메탄 배출량 더 정확히 산정&quot;…농진청 '배출계수' 추가 개발,https://n.news.naver.com/mnews/article/002/0002383569?sid=102,"국가 온실가스 총배출량 산정과 감축량 평가, 탄소중립 정책 수립 등에 폭넓게 사용된다. 주요 선진국들은... 이에 따라 국내에서도 국립축산과학원이 한우 장내 발효 메탄 배출계수 4종을 추가 개발하고 환경부 산하... "
"농진청, 사육환경 반영 한우 '메탄 배출량' 배출계수 개발",https://n.news.naver.com/mnews/article/654/0000116289?sid=102,"평가, 탄소중립 정책 수립 등에 폭넓게 사용되고 있다. 우리나라를 포함한 대부분의 국가에서는 '기후변화에... 국립축산과학원은 한우 장내 발효 메탄 배출계수 4종을 추가 개발하고, 환경부 산하 온실가스종합정보센터... "
"농진청, 한우 성별·성장단계 반영한 메탄 배출계수 개발",https://n.news.naver.com/mnews/article/003/0013184182?sid=101,"평가, 탄소중립 정책 수립 등에 폭넓게 사용된다. 현재 대부분의 국가는 '기후변화에 관한 정부 간 협의체... 개발하고, 환경부 산하 온실가스종합정보센터의 검증을 거쳐 지난해 12월 국가 배출계수로 최종 등록했다.... "
한우 장내 발효 메탄 배출계수 개발…“메탄 배출량 7% 감소 전망”,https://n.news.naver.com/mnews/article/119/0002945299?sid=101,"평가, 탄소중립 정책 수립 등에 폭넓게 사용된다. 우리나라를 포함한 대부분의 국가에서는 ‘기후변화에... 우리나라에서는 국립축산과학원이 한우 장내 발효 메탄 배출계수 4종을 추가 개발하고, 환경부 산하... "
"농진청, 한우 메탄 배출량 배출계수 개발…&quot;정확도 높인다&quot;",https://n.news.naver.com/mnews/article/001/0015330563?sid=101,"평가, 탄소중립 정책 수립 등에 폭넓게 사용된다. 우리나라를 포함한 대부분의 국가에서는 '기후변화에 관한... 국립축산과학원은 한우 장내 발효 메탄 배출계수 4종을 추가 개발하고, 환경부 산하 온실가스종합정보센터... "
"지현영 녹색전환연구소 부소장 &quot;기후·환경, 더는 주변 이슈 아냐…대선...",https://www.electimes.com/news/articleView.html?idxno=353405,"기후·환경 정책의 향방에 대한 관심이 그 어느 때보다 높아지고 있다. 특히 탄소중립과 정의로운 전환, 국제... &quot; ▶윤 전 대통령 파면을 환경 분야에서는 어떻게 보는지. &quot;전화위복이라 생각한다. 윤석열 정부가 2027년까지... "
국내 첫 기후소송 1년…시민 주도 '기후 책임' 전세계로 확산,https://www.itbiznews.com/news/articleView.html?idxno=165715,플랜1.5 윤세종 변호사는 헌법재판소가 기후위기 대응을 위한 탄소중립 및 녹색성장 기본법 제8조 제1항에... 대만의 환경권리재단 조에 황 변호사는 2023년 발효된 대만 기후법이 실질적인 감축 목표 없이 환경부에... 
"[부산 브리핑 모음(4월15일)] 동의대, 2025년 파란사다리 사업 8년 연속...",https://www.dnews.co.kr/uhtml/view.jsp?idxno=202504142223232860358,"김영욱 부산진구청장은 “커피박 공공수거 및 순환 경제 사업은 환경 보호 및 탄소중립 실현에 크게... 수달은 환경부 멸종위기야생생물 1급이자 천연기념물로 지정되어 있으며, 깨끗한 1급수에서만 서식하는 것으로... "
"'축산 악취' 개선 누가, 어떻게 하나?",http://www.youngnong.co.kr/news/articleView.html?idxno=51641,"환경부 장관 역시 &quot;가축분뇨는 잘 활용하면 귀중한 영양분이 되지만 그 양이 늘면서 처리방식의 다각화가 매우 중요해졌다.&quot;면서, &quot;가축분뇨가 바이오에너지 등 새로운 자원으로 다시 태어나 탄소중립 및 환경오염 방지에... "
[정수종의 기후변화 이야기]숲이 없는 미래는 없다,https://n.news.naver.com/mnews/article/032/0003363325?sid=110,"수자원 분야(환경부), 도시숲 및 산불관리 분야(산림청), 재난 분야(행정안전부), 계절 예측 분야(기상청)... 특히 기후위기 시대 전 세계인의 난제인 탄소중립과 관련해 한국의 산림은 국가 온실가스 배출량을 줄여주는... "
김호은 신임 전북지방환경청장 취임 &quot;촘촘한 환경 안전망 구축&quot;,http://www.jeonmin.co.kr/news/articleView.html?idxno=416116,김 청장은 취임사를 통해 &quot;환경부의 정책 추진 방향에 맞춰 전북 지역 주민들이 체감할 수 있는 촘촘한 환경... 소통·협력해 기후위기 대응을 위한 탄소중립 이행과 지역 환경 현안 해결을 위해 적극 노력하겠다&quot;고 말했다.
김호은 전북지방환경청장 &quot;주민 체감 환경 안전망 구축&quot;,http://www.domin.co.kr/news/articleView.html?idxno=1510300,위한 탄소 중립 이행 및 지역 환경 현안 해결에도 업무 추진의 초점을 맞추겠다&quot;고 언급했다. 신임 김호은 청장은 한양대 화확공학과를 졸업해 지난 2003년 제38회 기술고시 합격 후 공직생활을 시작했다.이후 환경부... 
김호은 신임 전북지방환경청장 부임,http://www.jjn.co.kr/news/articleView.html?idxno=1002913,통해 &quot;환경부의 정책 추진 방향에 맞춰 전북 도민들이 체감할 수 있는 촘촘한 환경 안전망을 구축하겠다&quot;며 &quot;유관기관 및 시민사회 등 다양한 이해관계자와 긴밀히 소통·협력해 기후위기 대응을 위한 탄소중립 이행과... 
"&quot;공공 소각장, 일방 추진 말고 공개 입찰하라&quot;",http://www.energydaily.co.kr/news/articleView.html?idxno=155082,위해 환경부가 중심이 되어 광역 단위 소각시설 건설을 주도해야 한다&quot;고 강조했다. 탄소중립과 기후 변화... 서울시와 환경부에 주민 동의 절차를 우선시하는 정책 전환을 강력히 촉구했다. 특히 소각장 입지 선정과... 
김호은 신임 전북지방환경청장 취임,http://www.jeollailbo.com/news/articleView.html?idxno=764556,"위한 탄소중립 이행을 비롯, 지역 환경현안 해결을 위해 적극적으로 노력하겠다&quot;고 덧붙였다. 김 청장은 한양대학교 화학공학과를 졸업하고 지난 2003년 제38회 기술고시 합격 후 공직생활에 첫발을 내디뎠다. 이후 환경부... "
"그린피스, 국내 첫 기후소송 1년 '기후 책임' 전 세계로 확산",http://www.ikld.kr/news/articleView.html?idxno=311474,"플랜1.5 윤세종 변호사는 헌법재판소가 기후위기 대응을 위한 탄소중립 및 녹색성장 기본법 제8조 제1항에... 없이 환경부에 책임을 전가한 점을 비판하며, 이는 기후법과 헌법을 모두 위반한 것이라고 지적했다. 그는... "
&quot;국내 첫 기후소송 1년… 시민이 묻는 '기후 책임' 전 세계로 확산&quot;,http://www.energydaily.co.kr/news/articleView.html?idxno=155073,플랜1.5 윤세종 변호사는 헌법재판소가 기후위기 대응을 위한 탄소중립 및 녹색성장 기본법 제8조 제1항에... 대만의 환경권리재단 조에 황 변호사는 2023년 발효된 대만 기후법이 실질적인 감축 목표 없이 환경부에 책임을... 
[인사] 산업부·해수부·환경부 등,https://www.safetimes.co.kr/news/articleView.html?idxno=228406,오성현 ■ 환경부 ◇국장급 승진 ▲전북지방환경청장 김호은 ▲대구지방환경청장 김진식 ◇과장급 전보... 송기진 ▲청년정책협력관 류승목 ▲2050탄소중립녹색성장위원회 사무처기획총괄국장 김규형 ◇국장급 전보... 
김호은 신임 전북지방환경청장 &quot;도민 체감하는 환경 안전망 구축&quot;,https://n.news.naver.com/mnews/article/421/0008191267?sid=102,통해 &quot;환경부의 정책 추진 방향에 맞춰 전북 도민들이 체감할 수 있는 촘촘한 환경 안전망을 구축하겠다&quot;며 &quot;유관기관 및 시민사회 등 다양한 이해관계자와 긴밀히 소통·협력해 기후위기 대응을 위한 탄소중립 이행과... 
기후위기 대응은 국가 지도자의 시대적 사명,https://n.news.naver.com/mnews/article/047/0002469605?sid=102,환경부가 계획하고 있는 '기후 댐' 예산은 '녹색 댐'에 투입되어야 한다. 사람과 마찬가지로 건강에는 때가... 대통령 직속 민관 합동 심의기구인 '2050 탄소중립녹색성장위원회'안에 전문기구로 '청색기술경제 위원회... 
"춘천시, 전기이륜차 15대 보급",https://gw.newdaily.co.kr/site/data/html/2025/04/12/2025041200027.html,뉴데일리 이달수 기자 = 강원도 춘천시(시장 육동한)가 온실가스 감축과 탄소중립 실현을 위해 전기이륜차... 대리점은 환경부 전기자동차구매보조금 지원시스템에 신청서와 필요 서류를 등록하면 된다. 자세한 문의는... 
알아두면 좋을 2025ver. 국내 환경 정책,https://www.allurekorea.com/2025/04/14/%ec%95%8c%ec%95%84%eb%91%90%eb%a9%b4-%ec%a2%8b%ec%9d%84-2025ver-%ea%b5%ad%eb%82%b4-%ed%99%98%ea%b2%bd-%ec%a0%95%ec%b1%85/?utm_source=naver&utm_medium=partnership,"지원하는 정책을 도입했다. 다자녀가구의 경우, 기존 보조금 10% 추가 지원 방식에서 최대 300만원까지 정액 지원하는 방식으로 개편했다. NET ZERO POINT ‘탄소중립 실천’이라는 메시지와 함께 300원가량의 소액이... "
[인사] 국무조정실·국무총리비서실 외,https://www.viva100.com/article/20250413500634,송기진 △청년정책협력관 류승목 △2050탄소중립녹색성장위원회 사무처기획총괄국장 김규형 &lt;국장급 전보... 임용&gt; △국토정보정책관 방현하 ◆환경부 &lt;국장급 승진&gt; △전북지방환경청장 김호은 △대구지방환경청장 김진식... 
"진주시, 탄소중립 녹색성장 기본계획에 시민 참여 높인다.",https://n.news.naver.com/mnews/article/658/0000103731?sid=102,시는 공청회에서 수렴된 의견을 반영해 기본계획을 확정해 오는 5월까지 환경부에 제출할 계획이다. 진주시 관계자는 “탄소중립 정책의 실효성을 높이기 위해 시민들의 참여가 필수적이다”며 “많은 시민이 공청회에... 
&quot;환경지키고 무료 커피&quot;…청주시-스벅 '사용컵 회수' 협약,https://n.news.naver.com/mnews/article/422/0000730551?sid=102,"청주시가 환경부, 스타벅스와 함께 플라스틱컵 재활용을 촉진하기 위한 협약을 맺었습니다. 다음 달... 등 정책을 추진하고 있습니다. &lt;이범석/청주시장&gt; &quot;기후 위기나 이런 탄소중립이 시급하고 절대적인 과제이기 때문에... "
"진주시, 탄소중립 녹색성장 기본계획 수립을 위한 공청회",https://n.news.naver.com/mnews/article/003/0013179968?sid=102,"5월까지 환경부에 제출할 계획이다. 시 관계자는 “대형산불 발생, 이상 고온, 국지적인 폭우와 가뭄 등 기후위기를 체감하고 있는 지금, 탄소중립 정책의 실효성을 높이기 위해서는 시민들의 참여가 필수적이다”며... "
"진주시, 탄소 중립·녹색 성장 기본계획 시민 공청회 개최",http://www.metroseoul.co.kr/article/20250411501367,"5월까지 환경부에 제출할 계획이다. 관계자 시는 &quot;대형 산불 발생, 이상 고온, 국지적 폭우와 가뭄 등 기후 위기를 체감하고 있는 지금 탄소 중립 정책의 실효성을 높이려면 시민들 참여가 필수적&quot;이라며 &quot;많은 시민이... "
새 정부에선 어떤 조직…'정부조직법 개정안' [법안 돋보기],https://n.news.naver.com/mnews/article/011/0004473332?sid=100,"“한국도 기후위기 대응 전담 부처 필요” 탄소 중립과 신재생에너지 사업을 위한 ‘기후에너지부’ 신설... 법안은 기후에너지부를 중앙부처로 신설하고, 산업통상자원부, 환경부, 국토부, 농림부, 해수부, 기상청 등 여러... "
이태훈 달서구청장 &quot;녹지공간 조성으로 명품 숲 조성 노력한다&quot;,https://www.ajunews.com/view/20250412114528194,대상(환경부문 환경부장관상)과 대한민국 도시대상(기후변화 우수정책 특별상)을 수상했다. 이어 달서구는 저탄소 인증기관 선정과 기후위기 대응 지역기반 마련을 위한 탄소중립 녹색성장 기본계획을 수립하고... 
"&quot;금리 우대·녹색채권·친환경 상품&quot;…금융권, 탄소 줄이기 '총력'",https://www.econovill.com/news/articleView.html?idxno=690178,"환경·사회·지배구조(ESG) 관련 상품과 투자 규모를 오는 2030년까지 50조원, 환경 부문은 25조원으로... 기업, 탄소 중립 핵심기술 보유 기업에 대한 투자를 중점적으로 진행한다. 정책금융, 저탄소 전환 기업, 친환경... "
"녹색금융, CEO 경영 평가 잣대된다",https://www.econovill.com/news/articleView.html?idxno=690066,"확대, 탄소중립 기반 마련 등과 관련된 환경경영 활동이 상세히 담겨있다. KB금융은 기업의 사회적 책임을... 다양한 환경분야에 대한 금융회사의 역할을 보다 충실히 이행하고 있다&quot;고 설명했다. 2024년 6월 함 회장은... "
"'지속가능금융' 기틀 마련하라...은행권, 전환금융 '잰걸음'",https://www.econovill.com/news/articleView.html?idxno=689804,"김완섭 환경부 장관이 축사에서 언급한 이같은 발언은 기후위기에 대한 긴장감을 담은 경고 메세지로... 적극적인 정책적 지원을 확대하고 기업들이 이를 활용해 친환경 산업 전환을 가속화한다면, 탄소중립 사회... "
"스타벅스, 연내 2천여 전매장에 '텀블러 세척기' 보급…목표 1년 당겨",https://n.news.naver.com/mnews/article/421/0008188573?sid=101,"환경부, 일회용품 감량 추진단 해체…산업 지원에만 정책역량 집중 비판 세척기 설치 사업은 지난해 4월 한화진 전 환경부 장관(현 2050탄소중립녹색성장위원회 위원장)과 손정현 에스씨케이컴퍼니(SCK) 대표이사, 이현욱... "
[기자의 눈] 기후는 생존 문제…차기 정권은 전담부처 만들어야,https://www.ekn.kr/web/view.php?key=20250411028186192,환경부 한 부처만으로는 역부족인 시대다. 산업·에너지·재정·복지를 아우르는 '기후에너지부' 또는... 어떤 정치세력이 권한을 가지느냐에 따라 정책의 방향과 실행력은 완전히 달라질 수 있다. 탄소중립이라는 목표가... 
&quot;친환경 청정축산 이끌어갈 주역&quot;···16개 농가 영예의 얼굴,http://www.agrinet.co.kr/news/articleView.html?idxno=335993,"축산정책관·김경록 환경부 수질생태과장이 참석, 인사말과 축사를 통해 '청정축산환경대상'의 시대적... 강화되고 탄소 중립과 가축 질병 발생에 따른 깨끗한 축산으로의 변화 요구도 증대되고 있다. 축산업의 지속가능한... "
4년 남은 지구촌 '기후위기 시계'... 역주행 美 눈치 볼 땐가,https://www.m-economynews.com/news/article.html?no=53212,"때 탄소중립을 향한 일관적 정책 수립 및 이행이 바람직하다”고 했다. ◆기업, 브랜드 이미지 향상 위해... 강부영 환경부 국제환경협약팀 팀장은 “트럼프는 1~2년 후면 레임덕이 시작될 가능성이 크다”며... "
"환경부, 인니 녹색전환지원단 파견 … &quot;韓 녹색기업 진출 모색&quot;",https://biz.newdaily.co.kr/site/data/html/2025/04/11/2025041100320.html,"기후·환경분야의 협력과 우리 녹색기업의 진출방안에 대한 논의를 이어가기로 합의했다. 우리나라는 현재 인니에서 누산따라 신수도 탄소중립 인프라 구축사업, 발리 전기자동차 및 충전인프라 보급 시범사업, 덴파사르... "
마카오 환경 협력 포럼 및 전시회(MIECF 2025) 참관기,http://dream.kotra.or.kr/kotranews/cms/news/actionKotraBoardDetail.do?SITE_NO=3&MENU_ID=110&CONTENTS_NO=1&bbsGbn=245&bbsSn=245&pNttSn=227963,"Tam Vai Man의 환영사가 진행됐으며, 이어 중국 생태환경부 당조서기 겸 부부장 Mr. Sun Jinlong과... ‘2050 탄소중립 로드맵*’을 중심으로, 재생 가능 에너지 확대, 전기차 인프라 구축, 스마트 에너지 관리... "
"&quot;트럼프 취임 후 기후·에너지 정책 급변…韓, 에너지 주권 확보에 집중...",https://www.electimes.com/news/articleView.html?idxno=353313,혹은 탄소중립을 명분만으로 고집한다는 것은 현재의 패러다임과 괴리가 있다&quot;고 주장했다. 끝으로 &quot;에너지는... 상무 ▲정윤화 환경부 기획재정담당관실 서기관 ▲주영근 포스코 경영연구소 수석연구원이 토론을... 
"춘천시, 전기이륜차 15대 보급",https://n.news.naver.com/mnews/article/002/0002383137?sid=102,감축하고 탄소중립 실현을 위해 전기이륜차 15대를 보급한다고 밝혔다. 지원 차량은 신규 구매해 국내에 신규... 대리점은 환경부 전기자동차구매보조금 지원시스템에 신청서와 필요 서류를 등록하면 된다. 자세한 문의는... 
